
b'Taking innovation to The Bank at #TCFHackathon',b'ideation happening at the #tcfhackathon \xf0\x9f\x92\xa1 https://t.co/DbNUDNnTd0',b'So excited to be a part of this event today #TCFhackathon https://t.co/3Iv3KKv49U'
b'RT Will you join us to witness history On 24/04 #MillicentFawcett will become the first woman commemorated with a statue\xe2\x80\xa6',b'April 20 2018 (https://t.co/ZFdyj2Aczl Newswire Digital marketing is mired in controversy today with the Cambrid https://t.co/EUH9v0CMEk',b'RT _org Pragmatic farmers use homeopathic medicine to improve animal welfare and at the same time improve their bottom line What is\xe2\x80\xa6',b'I posted a new video to Facebook https://t.co/XfUbea1Bvy',b'Show open last nite pt 1 of Thurs/Fri dbl header wknd #NorthsideTavern #FreddieKing &amp #HowlinWolf Things only got https://t.co/QsxlgKL4fV',b'Phew https://t.co/Nz0yOrU68M',b'RT _Dior I have Cash app Venmo PayPal Apple Pay Facebook messenger pay and google pay Cause what you NOT bout to do is give me an\xe2\x80\xa6',b'RT if you look at your Facebook feed everybody there is having a fucking grand old time Look eight people got married this week\xe2\x80\xa6',b'RT Request to take strict action against Durga Malathi from Pattambi for abusing Religious symbols of Hindus o\xe2\x80\xa6',"b""I do this shit too just don't record myself...only for friends and family!! #AWESOMENESS https://t.co/Advquj8DG0""",b'There is nothing in the bible that mentions guns....PERIOD https://t.co/iXaI3sZJBF',"b""RT Its GameOn _official vs _officiel Sunday April 22nd '18 Via _Magazine here https://t.co/\xe2\x80\xa6""",b'RT Facebook Plans to Build Its Own Chips For Hardware Devices https://t.co/84LKLrQlFc via',b'RT Facebook is going to force all of those who continue to use their social media service to accept being tracked around th\xe2\x80\xa6',b'New FVP SuperClean and Splash products https://t.co/ZI8tSUxyGi',b'RT Byron Katie meet-up at The Playful Soul next week https://t.co/yBgqzWPKCv',b'How to use Facebook for Network Marketing https://t.co/opYOYyVNiN #homebusiness #mlm #networkmarketing',b'Hurry up...Ends 4/28 https://t.co/Tm3TFFPbQs',b'Try not to guys https://t.co/3bKuG0W0d2',b'\xf0\x9f\x8e\x88\xf0\x9f\x8e\x88\xf0\x9f\x8f\xa1OPEN HOUSE\xf0\x9f\x8f\xa1\xf0\x9f\x8e\x88\xf0\x9f\x8e\x88 \xf0\x9f\x93\x8d3010 Summer Swan \xf0\x9f\x93\x86Friday 12-5 pm \xf0\x9f\x93\x86Saturday 11-4 pm \xf0\x9f\x93\x86Sunday 11-4 pm CURB APPEAL CUL-DE-SAC https://t.co/DKpbTbdIjv',"b""And as part of Friday's music-stravaganza we have More Tuba Please https://t.co/0Jh8HbMJqE""",b'RT 4/27 at 11:30 am Stand Against Racism Fountain Square 520 Vine St Cincinnati https://t.co/UZqVnIIi2z https://t.co/\xe2\x80\xa6',b'I bet those kids disagree! #DrainingTheSwamp huh https://t.co/oiRt2u6qfu',b'Congratulations to the School in the on their 100th anniversary The TCCB-Ed Dep pr https://t.co/L6aGyP4eQn',"b""RT **FRIDAY FREEBIE* Let's have a fantastic Friday we're giving one lucky Facebook follower the chance to #WIN a mystery p\xe2\x80\xa6""",b'RT Watch #Kol\xc3\xb2n Official Video by Released 2018 Genre #WorldBeat. WATCH NOW ON #AYITISAKAPFET.COM #TR\xe2\x80\xa6',b'ISBAT got talent .. https://t.co/uPvw09qEEf',b'ATTENTION SOUTHERN VIEW PASSENGERS Due to ongoing sewer work today and early next week you may experience closed https://t.co/HVwwM7SOJz',b'Friend selling his clean volks Honda specs Good deal https://t.co/QuCAfT7Tdj',"b'RT ME I really like [TV show film or book] FACEBOOK oh I love [TV show film or book too! TWITTER actually [TV show,\xe2\x80\xa6'","b""Inside Facebook's Feel-Good Road Show https://t.co/kw4QjFYJxF""",b'I posted a new video to Facebook https://t.co/V6s9v2wFVH',b'Make sure you and your kids are getting enough sleep! #SleepDeprivation #AGoodNightsSleep #Kidnectivity https://t.co/vnHv3w5VYl',b'While Pretoria was sleeping last night the General of God Bishop Joshua arrived fully loaded and ready to deliver. https://t.co/9qVVqG3C8E',b'Enjoy your fairy fabulous day &lt;3 https://t.co/ZhUQsOVOLx',"b""RT Psychic Breakfast Show with Derek and John please share. today's subject love over hate and peace over war https://t.\xe2\x80\xa6""",b'RT GET YOUR GLOW ON #WIN the ULTIMATE St.Tropez festival tanning kit AND a \xc2\xa3200 PLT voucher \xf0\x9f\x98\xb1\xf0\x9f\x92\x95\xf0\x9f\x99\x8c To enter follow \xe2\x80\xa6',"b'RT How to express your exasperation at yet another ""school walkout"" Grab my free eBook Your Facebook Friends Are Wrong Abou\xe2\x80\xa6'","b""Fmr FBI Deputy Dir Andrew McCabe's lawyers say they aim to fight back against his firing That he/they are just b https://t.co/fz5khxyk2t""","b""It's Friday go be a legend this weekend.. https://t.co/7CCSidKaoJ""","b""Facebook is having issues since 11:50 AM EST https://t.co/YbrNS7dpo9 RT if you're also affected #FBdown https://t.co/Zt17eZj3Dn""",b'Thanks for the follow Inovateus Solar is now following me on Twitter https://t.co/Zabyt4gwdW You can also find me https://t.co/uteX9SRBRj',b'Are you Ready to Thunder \xe2\x9a\xa1 #mosidayofthunder2018 #mosidot 25.05.18 https://t.co/nullbO6RyS',b'RT Happy #420 !!!! Tommy Chong out here blazing to my music \xf0\x9f\x92\xa8\xf0\x9f\x94\xa5\xf0\x9f\x99\x8c #Legend What songs y\xe2\x80\x99all smoking to today https://t.co/8\xe2\x80\xa6',b'Good Morning https://t.co/HevTVpLeOW',b'Good morning everyone.. Please join us for some wine &amp cheese while touring our #OpenHouse this Saturday &amp Sunday 1 https://t.co/8i7M0w3BNM',b'great video on You Tube I just posted it on my Facebook page https://t.co/CZwRAHhl1K',b'How to Use Customer Lifetime Value to Clone a Facebook Audience https://t.co/yav2SLmw0L https://t.co/PLWuDrvHX1',b'COVER REVEAL Title Cruise A Moonshine Task Force Series Novel Author Laramie Briscoe Genre Contemporary Romance https://t.co/A5uTh9DiNU',"b""RT _VIRGO Don't forget this Friday is killer instinct and king of fighter 14 https://t.co/O44r09PYeD""",b'Wonderful post by career coach Laura Simms Take heart entrepreneurs https://t.co/mabpMo3Iq1',b'RT Earth Day 2018 Recycle Read more and join our clean up event https://t.co/1C46W9dJA9 #sunmoney #EarthDay2018 https\xe2\x80\xa6',b'Accommodations In Telluride https://t.co/8i7xSmWsiO',b'Celebrate #GenderParity with Trinity Rep which has received a Standing O for this production https://t.co/amszjOouiC',b'Scooby ScoobyScooby jkkkkkkkkkk https://t.co/aIPxXzejxH',b'RT \xe2\x9a\xa1\xef\xb8\x8fTICKET GIVEAWAY\xe2\x9a\xa1\xef\xb8\x8f Want to win a pair of tickets to on 4/24 at ? RT this post Follow us &amp \xe2\x80\xa6',"b""RT Is your toner gentle enough Stick to #GarnierMicellarWater tested and proven to be as gentle as water \xf0\x9f\x92\xa7Don't believe us?\xe2\x80\xa6""",b'Fantastic! What a wonderful example of the long-term connections &amp friendships made at WISE #WISEwomen Lorna Oppe https://t.co/tkmU1GhotO',b'#garyveebreakfast I want to break bread with my inspiration for #facepunchfoods is why I started my compan https://t.co/ZfEzIAzODf',"b'Did you know since flying for the first time in 1965 the Royal Air Force Aerobatic Team has performed almost 4,900 https://t.co/GhQ7LrZMk5'",b'Please remember to join us THIS WEDNESDAY at the Faith and Peaceful Relations Forum here at to explore a https://t.co/gfEedMbaSq',b'The morning started at Schnell with a family breakfast served up by Schnell staff Students gave tours of the build https://t.co/zIyS78Z1cJ',"b""Dan Oxley attended a Newham hustings this week and it's a real gem Reads out nonsense Gets up and walks out Firs https://t.co/aAiTelE3Wd""",b'Noise Test v Eternia Music w Loxy Overlook Antagonist &amp more at Blue Mountain Club #Bristol / 18.05.18 // https://t.co/MubyodbYBB',b'What did I just watch?...Wtf https://t.co/cxUejAaL2J',b'RT _3 Dear this FB user https://t.co/xKnckA3stn Durga Malathi has created and is sharing deeply o\xe2\x80\xa6',b'Agree https://t.co/YpBlVmeWTV',b'Gein &gt Morning Star Moving Shadow Join Us Now ! https://t.co/Qbr7WEfuse #DnB #DrumnBass #Bass #Drum https://t.co/7U1J8rsg2f',b'RT Fun fact Facebook deletes your search history after six months Not-so-fun fact It also tracks your mouse movements https://t.c\xe2\x80\xa6',"b""RT *As seen on Facebook* Our able governor. His style is a mixture between 'Cheers baba' 'Iza mtu nguyaz &amp 'Rasta man never\xe2\x80\xa6""",b'RT omggg can u believe Hansol\xe2\x80\x99s mom commented on a facebook fan page\xe2\x80\x99s post about Seungcheol??? https://t.co/Mz8fTCCSba',b'I posted a new video to Facebook https://t.co/6Fp9783pCd',b'RT Download &amp Listen to #Anita New Single by _ Released 2018 Genre #Afrokata. #AINITAPROMO LISTEN NOW ON #AY\xe2\x80\xa6',b'\xf0\x9f\x94\x8a Last call \xf0\x9f\x9a\x97 https://t.co/lE0lrQyKm7',b'RT _AI Here\xe2\x80\x99s another piece that can give you an understanding of our strategy and ideals Also you can see how we can interfere\xe2\x80\xa6',b'Year of the dog WHERE MY DOGS @\xf0\x9f\x90\xb6 https://t.co/px7X5nLzpQ',b'I don\xe2\x80\x99t see it on the Facebook page could you send it to me? Thank you!',"b""RT HimUp here too T^T BABYz please go to the organizer's page here to watch the full vid and leave lots of reaction to show y\xe2\x80\xa6""",b'RT Blue Haven Bookshop merch price list Chibi pillows PHP 320 each Drawstring bag and T-shirt PHP 210.00 each\xe2\x80\xa6',b'RT 420 is the weed number but the number that matters most is 2.6 million the number of people that die every day from a marij\xe2\x80\xa6',b'\xf0\x9f\x92\x9b\xf0\x9f\x90\xb6 CARING FOR YOUR PET \xf0\x9f\x8c\x9f\xf0\x9f\x90\xb1\xf0\x9f\x92\x9b Looking after your pets health and well being is the best love #petcare Is your pet https://t.co/QjhUKUrq65',b'Happy Friday!!...Specials for the Day!.. Soup Du Jour New England Clam Chowder $4.99 Pepper Jack Bites Cubed Peppe https://t.co/h2NurE4bdc',b'It\xe2\x80\x99s not just Starbucks White fear is an American problem via The Boston Globe https://t.co/sFVVMXbnGy',b'RT _ I literally open Facebook and what do I see?? two more friends married!!',"b""I'm stocking up on my way home I've had a long fkn week I'm so over today https://t.co/p6Nl4pQyeb""","b'RT _DogsSK ""De-worming all done time to play on a sunny Friday afternoon."" #SouthKorea \xe2\x9e\xa1\xef\xb8\x8fhttps://t.co/svaleA3Fq5 https://t.co/s\xe2\x80\xa6'",b'A beautiful day! #fightingcancerwithhope#feelbeautifultoday https://t.co/oQvk9Wxtx5',b'Preview of Dr Bart Wilson from Chapman University speaking in our Adam Smith Week opening panel discussion on the https://t.co/jCM1nuR5eX',b'RT *Opens facebook https://t.co/mGm0cHp3RR',"b""RT It's 4.20 and our #FREE Ticket Friday Contest is \xf0\x9f\x94\xa5\xf0\x9f\x94\xa5lit\xf0\x9f\x94\xa5 with To Enter the contest go to https://t.co/1xtIprMqL\xe2\x80\xa6""",b'We recently listed 6299 &amp 6353 N State Road 135 Morgantown IN 46160 A beautiful ranch home with a great Brown C https://t.co/OBU2xyWbRh',b'I posted a new video to Facebook https://t.co/6sL4AJohyC',"b'RT Bruh somebody on Facebook just posted ""Having kids is like having broke lil best friends \xf0\x9f\x98\x82\xf0\x9f\x98\x82\xf0\x9f\x98\x82\xf0\x9f\x98\x82\xf0\x9f\x98\x82\xf0\x9f\x98\x82\xf0\x9f\x98\x82\xf0\x9f\x98\x82\xf0\x9f\x98\x82\xf0\x9f\x98\x82'",b'RT As mentioned on #ChallengeMania 3\xef\xb8\x8f\xe2\x83\xa3ways you can win an jersey 1\xef\xb8\x8f\xe2\x83\xa3Photoshop contest submit a cool Abe-include\xe2\x80\xa6',b'For your final exam and 50 of your final grade for the term: Compare &amp contrast with the U.S.A. https://t.co/xoRny3Cvm8',b'Road rage incident leaves one dead https://t.co/gfAG5qc4ll',b'RT Facebook is fucking wild https://t.co/JZ3Klsu7Im',b'Super fun ideas for the home!! https://t.co/GtnSVE3Jxv',b'RT Spread the conspirancy to your friends families and relatives through whatsapp &amp facebook. #CBNMediaExposed',"b""The countdown is on until the Aberdeen Young Professionals Ball tonight at 7pm where I'm a finalist for Mentee of https://t.co/M51I76Rc84"""
b'RT #BreakingNews #WellsFargo fined $1B by federal regulators for abuses in #mortgage and #auto lending The bank will pay $50\xe2\x80\xa6',b'RT We ended up selling before could foreclose We are renters now I\xe2\x80\x99m 54 Home ownership no longer realistic\xe2\x80\xa6',b'RT In 2012 wells fargo advertised loans to people who had experienced a foreclose 3 yrs prior\xe2\x80\xa6',b'RT _the One of the scumiest financial services firms out there The pressure on \xe2\x80\x9ccross-selling was off\xe2\x80\xa6',b'I understand you\xe2\x80\x99re frustrated If you reconsider and decide you would like us to look into what hap https://t.co/ij7Y83UcfR',b'We need candidates who bring law and order to Wall Street and mass-incarcerate corporate executives starting with those from',"b""Hi there If there is a specific concern you have please let me know and I'll try my best to help (no acco https://t.co/fP9PZzckJc""",b'RT Quick take on the initial breaking news on the #WellsFargo $1 billion fine to the Feds today This is the biggest f\xe2\x80\xa6',b'The world in brief courtesy of The Economist Espresso Signs of Korean detente Comey memos leaked April 20th 2 https://t.co/6ObNDYZxdq',b'The world in brief courtesy of The Economist Espresso Signs of Korean detente Comey memos leaked April 20th 2 https://t.co/3vs73lhGhj'
"b""Check me out on CNBC's Closing Bell today at 3:10 pm central where I'll take #WellsFargo to task for its fraudulent https://t.co/mviSM2W9I5""","b""When any current or former executives are sentenced to jail I'll pay attention. A fine They can affor https://t.co/mtKT50qMPJ""",b'Seriously How hard is it to get in touch with your customer service dept??? The toll free customer ser https://t.co/4VPrNUaJdd',"b""That's what you twats get Holding a payoff check from an accident to collect interest on another car payment I did https://t.co/Tl3fup6zD9""",b'RT #RELEASE Ranking Member Statement on Regulators Enforcement Action Against #WellsFargo READ https://t.co\xe2\x80\xa6',b'#MAGA hmmm why do we have regulations? Because we have companies like Wells Fargo. #DrainTheSwamp of greedy fo https://t.co/ERTPTmneNE',b'#WellsFargo Hit With $1 Billion In Fines Over Consumer Abuses #banking #ConsumerFinancialProtectionBureau... https://t.co/LSHnJxRUoM',b'RT _rb may . and its lobbyists be successful in killing . &amp . They clearly\xe2\x80\xa6',b'RT _had_a_tweet We need candidates who bring law and order to Wall Street and mass-incarcerate corporate executives starting with those\xe2\x80\xa6',b'That was awesome Tanya',b'RT We ended up selling before could foreclose We are renters now I\xe2\x80\x99m 54 Home ownership no longer realistic\xe2\x80\xa6',"b""RT Please if you're going to pay that half-billion dollar penalty with a personal check make sure you have\xe2\x80\xa6""",b'RT We ended up selling before could foreclose We are renters now I\xe2\x80\x99m 54 Home ownership no longer realistic\xe2\x80\xa6',b'On top of $1 billion fine #WellsFargo to draft plan for remediation of harmed customers #CFPB https://t.co/b2xzrQswgu',b'RT I remember being coached by a broker What numbers to use to secure our loan We did Seven years later th\xe2\x80\xa6',b'you are tone deaf on guns safety And you have paid the price with teachers Not a smart move. https://t.co/rAKb8kbK6K',b'RT . whacked with $1bn fine for lending violations https://t.co/DjkzKEgCHj #WTF #fintech #banking #mortgages',b'Strike 2!',b'\xe2\x80\x9cOn behalf of Wells Fargo I can\xe2\x80\x99t comment on the lawsuit. says every #WellsFargo staff member ever!#ScandalRidden #Scandal',b'RT For once an American corporation stands firm to stay out of politics and not capitulate to liberal demands Salute to @\xe2\x80\xa6',b'RT I left my job at to change the world at with #Blockchain #preach #Synchroni\xe2\x80\xa6',b'Yeah but those people who stole the electronics were hungry and the people were playing a hi https://t.co/DEAufK5ln5',b'RT We ended up selling before could foreclose We are renters now I\xe2\x80\x99m 54 Home ownership no longer realistic\xe2\x80\xa6',b'A little justice #WellsFargo https://t.co/ZT7adI7Vns',b'RT #BreakingNews #WellsFargo fined $1B by federal regulators for abuses in #mortgage and #auto lending The bank will pay $50\xe2\x80\xa6',b'RT We ended up selling before could foreclose We are renters now I\xe2\x80\x99m 54 Home ownership no longer realistic\xe2\x80\xa6',b'RT In 2012 wells fargo advertised loans to people who had experienced a foreclose 3 yrs prior\xe2\x80\xa6',b'RT _the One of the scumiest financial services firms out there The pressure on \xe2\x80\x9ccross-selling was off\xe2\x80\xa6',b'I understand you\xe2\x80\x99re frustrated If you reconsider and decide you would like us to look into what hap https://t.co/ij7Y83UcfR',b'We need candidates who bring law and order to Wall Street and mass-incarcerate corporate executives starting with those from',"b""Hi there If there is a specific concern you have please let me know and I'll try my best to help (no acco https://t.co/fP9PZzckJc""",b'RT Quick take on the initial breaking news on the #WellsFargo $1 billion fine to the Feds today This is the biggest f\xe2\x80\xa6',b'The world in brief courtesy of The Economist Espresso Signs of Korean detente Comey memos leaked April 20th 2 https://t.co/6ObNDYZxdq',b'The world in brief courtesy of The Economist Espresso Signs of Korean detente Comey memos leaked April 20th 2 https://t.co/3vs73lhGhj',"b""You don't look a day over 39 \xf0\x9f\x98\x8e""",b'pay up You\xe2\x80\x99ve already raked the working man across the coals in your non banking efforts Ter https://t.co/XDEpyg0SR6',b'_WellsFargo I am still curious about the Wells-Fargo woman that died https://t.co/jV0dyRsvaU',b'RT . whacked with $1bn fine for lending violations https://t.co/DjkzKEgCHj #WTF #fintech #banking #mortgages',b'. whacked with $1bn fine for lending violations https://t.co/DjkzKEgCHj #WTF #fintech #banking #mortgages',b'may . and its lobbyists be successful in killing . &amp . They clearly deserve it!',b'My advice to you https://t.co/D8ZAx7kBj6',b'#RELEASE Ranking Member Statement on Regulators Enforcement Action Against #WellsFargo READ: https://t.co/6fCyqFpHRH',b'#WellsFargo will be #fined 1 #billion dollars #ConsumerFinancialProtectionBureau https://t.co/vpZ5jvR0DP',b'RT BREAKING We have severed ties with over their financial relationship with gun makers and the https://t.co/A\xe2\x80\xa6',b'has no control over the ethics and malpractices of its employees.. you lost 1 Crooks',b'#criminals #losangeles #lawsuit just curious is this a t https://t.co/6Sw3iZhVtE',b'_WellsFargo I have never had an account with this company How can I get the spam to stop?',"b""Disappointed but I gotta break up with They don't have any atms in my new town and I just paid $4.00 to use one No way jose""",b'RT Congrats to the #SEED20 People\xe2\x80\x99s Choice Grand Prize Winner Zach Bolster of for being today\xe2\x80\x99s \xe2\x80\xa6',"b""_WellsFargo it's ok i'll try later no big deal thanks for reaching out have a good day :)""",b'From Recode Recode Daily What comes next for Amazon after its 100 million Prime number https://t.co/hJLYTLLK54 https://t.co/nHHVay2QEj',b'Recode Daily What comes next for Amazon after its 100 million Prime number https://t.co/EzvCbZLlYg https://t.co/krx3DENhJ9',b'Hand out $12BILLION in cuts by Trump/Ryan/McConnell/Hatch/Brady to Citigroup-JPMorgan-WellsFargo- https://t.co/ZPPqnGWqbJ',b'RT BREAKING We have severed ties with over their financial relationship with gun makers and the https://t.co/A\xe2\x80\xa6',"b""RT Seriously If I'm $wfc I'm feeling pretty good right now Feds give me $3.7 billion take away $1 billion and\xe2\x80\xa6""",b'RT Just 1 Billion #WellsFargo https://t.co/QB9WyanddG',"b""Hi there I'd like to look into the issue to try to help Please send us a DM with your full name, https://t.co/bnKQZggMJ3""",b'Adding to and investment plans that\xe2\x80\x99s $650B in cleantech investments by https://t.co/kQ1w96PkeM',b'I apologize you feel this way Mark Is there something I can look into for you Please provide more https://t.co/9SWMCskN94',b'RT Congrats to #wellsfargo\xe2\x80\x99s Amie Parrish for being named one of the Top 50 Women in Business in the #CentralCoast by the \xe2\x80\xa6',b'RT Quick take on the initial breaking news on the #WellsFargo $1 billion fine to the Feds today This is the biggest f\xe2\x80\xa6',b'_WellsFargo No...i think you\xe2\x80\x99ve done quite enough already...kicked out of our house because of the shady BS pul https://t.co/y8X5VT43nb',b'FL Bought in 4/2004 x 3 hurricanes x everything else that ended up happening bankru https://t.co/ARXTXaMNZ2',b'Congrats to the #SEED20 People\xe2\x80\x99s Choice Grand Prize Winner Zach Bolster of for being today\xe2\x80\x99s https://t.co/yxBCknnff0',b'_WellsFargo How about you look into the Florida beach-front property you stole from me?',b'RT Irony alert Next door neighbor was senior CFPB official.',b'Recode Daily What comes next for Amazon after its 100 million Prime number https://t.co/rHexxy7UGK',b'RT If you deal with you are dealing with the Yakuza https://t.co/O0OkRPhLvk',b'RT We ended up selling before could foreclose We are renters now I\xe2\x80\x99m 54 Home ownership no longer realistic\xe2\x80\xa6',b'Wells Fargo is getting sued for $1 Billion and it is the best news I have heard all day #WellsFargoBank https://t.co/nKRDtNyXLI',b'RT Happy Friday!. Today we are serving lunch &amp from 11-1 Sorry for the change.',b'RT #Pizza lunch today4/20 Open 11-130 (Beaumont&amp;Pine)',b'Does the Overdraft Rewind function work with cash deposits I understand why it doesn\xe2\x80\x99t with checks.',b'RT . grants 200K to four local NorthBay organizations to continue supporting #NorCalFires recovery efforts \xe2\x80\xa6',b'#WellsFargo will need to dip into petty cash again (&amp probably raise fees again as well)... https://t.co/rCGBvz3AKm',b'RT Quick take on the initial breaking news on the #WellsFargo $1 billion fine to the Feds today This is the biggest f\xe2\x80\xa6',b'RT It\xe2\x80\x99s Friday Shop all of the new arrivals from our Insta story today from 11-1:30 \xf0\x9f\x8f\x83\xe2\x80\x8d\xe2\x99\x80\xef\xb8\x8f\xf0\x9f\x8f\x83\xe2\x80\x8d\xe2\x99\x80\xef\xb8\x8f\xf0\x9f\x8f\x83\xe2\x80\x8d\xe2\x99\x80\xef\xb8\x8f\xf0\x9f\x8f\x83\xe2\x80\x8d\xe2\x99\x80 https://\xe2\x80\xa6',"b""RT BREAKING is dropping as a recommended mortgage lender due to the bank's refusal to cut ties with the\xe2\x80\xa6""",b'RT _poet My mom lost her home and had to file bankruptcy because of Predators who hurt people.',b'How can I assist Daniel For security and privacy reasons do not include account numbers ^NR',b'It\xe2\x80\x99s the least you could do considering it\xe2\x80\x99s well known that your organization has repeatedly defraude https://t.co/PqmdMgIRjh',b'RT Quick take on the initial breaking news on the #WellsFargo $1 billion fine to the Feds today This is the biggest f\xe2\x80\xa6',b'_bruklis I noticed your tweet Rich and I want to make sure your concerns are addressed Please DM some more https://t.co/zVGjvyUGeG',b'School levy...Voting NO everytime from now on.',b'. wrote a series of articles on and a book on the mortgage indus https://t.co/0OpRTXgAnX',"b""RT I was so glad to refinance out of them to a company who doesn't sell thier mortgage is pure ev\xe2\x80\xa6""",b'Just think how many more you could have planted with the money for that billion dollar fine. https://t.co/myfekrDGMr',b'Ouch a 1 billion dollar fine less than a year from the account scandal I\xe2\x80\x99m starting to get nervous M https://t.co/yWiLfrvYhH',b'#NationalSchoolWalkout #420day #FridayFeeling #Happy420 #Arsenal #EarleBruce #Ocala #HigherSongs #Forbes400 https://t.co/P0rJInhEPz',"b""RT #WellsFargo #WellsFargoBank fails test over 'discriminatory and illegal practices CNNMoney https://t.co/Ap2Sj7W27K""",b'RT _Liberal_Tex Keep muzzles pointing down range while gun safety is being t\xe2\x80\xa6',b'_Liberal_Tex Keep muzzles pointing down range while gun safety is bein https://t.co/AB6ay6tLrV',"b""#WellsFargo #WellsFargoBank fails test over 'discriminatory and illegal practices CNNMoney https://t.co/Ap2Sj7W27K""",b'I apologize you feel this way Yessica Would you like me to look into this for you Please send a DM with https://t.co/r1a4zPPdC3',"b""RT We've opened up our story on settlement with today including insight from former #CF\xe2\x80\xa6""",b'The Wells Fargo mortgage and credit card abuses absolutely devastated investors credit scores #WellsFargoFine https://t.co/Ikh51KDs3J',b'RT Important to note that will pay $1 billion but actually settled for $1.5 billion The and money pe\xe2\x80\xa6',b'. fined $1 billion for insurance and mortgage abuses https://t.co/Hi80K3m3PE',b'RT _the One of the scumiest financial services firms out there The pressure on \xe2\x80\x9ccross-selling was off\xe2\x80\xa6',b'RT Sucks to own stock #wellsfargofine'
